{
  "schemaVersion": "1.0",
  "projectId": "agentlas-core-engine-meta-agent",
  "surface": "public-agent-package",
  "canonicalMemoryRoots": {
    "project": [".agentlas/project-soul-memory.md"],
    "agent_repo": ["memory.md"],
    "sitemap": [".agentlas/sitemap.json", ".agentlas/validation-ledger.jsonl"],
    "team_memory": [],
    "session": [".agentlas/memory-tickets.jsonl"]
  },
  "writeOwners": {
    "project": "10-single-agent-builder or 20-multi-agent-team-builder",
    "agent_repo": "30-agentlas-packager",
    "sitemap": "30-agentlas-packager",
    "team_memory": "30-agentlas-packager",
    "session": "AGENTS.md"
  },
  "promotionPath": [
    "worker-memory-events",
    "memory-ticket",
    "agentlas-packager-review",
    "policy-gate-if-shared"
  ],
  "trustLabels": ["verified", "memory_derived", "inferred", "stale_check_needed"],
  "exclude": [
    ".git",
    "node_modules",
    ".env",
    ".env.local",
    "*.pem",
    "*.key",
    "secrets/**"
  ]
}
